{
  "$schema": "https://json-schema.org/draft/2020-12/schema",
  "$id": "https://overlord.local/schemas/strategy-dsl/strategy_observation_evidence_bundle.schema.json",
  "title": "Overlord StrategyObservationEvidenceBundle",
  "type": "object",
  "required": [
    "strategy_observation_evidence_bundle_id",
    "schema_version",
    "generated_at",
    "paper_only",
    "live_execution_allowed",
    "order_placement_allowed",
    "strategy_observation_contract_id",
    "strategy_observation_input_set_id",
    "strategy_observation_noop_summary_id",
    "strategy_dry_run_stack_closeout_checkpoint_id",
    "strategy_definition_id",
    "strategy_run_intent_id",
    "source_strategy_observation_contract_id",
    "source_strategy_observation_input_set_id",
    "source_strategy_observation_noop_summary_id",
    "source_strategy_dry_run_stack_closeout_checkpoint_id",
    "source_strategy_definition_id",
    "source_strategy_run_intent_id",
    "replay_mode",
    "run_mode",
    "evidence_artifacts",
    "consistency_checks",
    "status",
    "reason"
  ],
  "additionalProperties": false,
  "properties": {
    "strategy_observation_evidence_bundle_id": { "type": "string", "pattern": "^soeb_" },
    "schema_version": { "const": "strategy_observation_evidence_bundle.v1" },
    "generated_at": { "type": "string", "format": "date-time" },
    "paper_only": { "const": true },
    "live_execution_allowed": { "const": false },
    "order_placement_allowed": { "const": false },
    "strategy_observation_contract_id": { "type": "string", "pattern": "^soc_" },
    "strategy_observation_input_set_id": { "type": "string", "pattern": "^sois_" },
    "strategy_observation_noop_summary_id": { "type": "string", "pattern": "^sons_" },
    "strategy_dry_run_stack_closeout_checkpoint_id": { "type": "string", "pattern": "^sdrscc_" },
    "strategy_definition_id": { "type": "string", "pattern": "^sdef_" },
    "strategy_run_intent_id": { "type": "string", "pattern": "^sri_" },
    "source_strategy_observation_contract_id": { "type": "string", "pattern": "^soc_" },
    "source_strategy_observation_input_set_id": { "type": "string", "pattern": "^sois_" },
    "source_strategy_observation_noop_summary_id": { "type": "string", "pattern": "^sons_" },
    "source_strategy_dry_run_stack_closeout_checkpoint_id": { "type": "string", "pattern": "^sdrscc_" },
    "source_strategy_definition_id": { "type": "string", "pattern": "^sdef_" },
    "source_strategy_run_intent_id": { "type": "string", "pattern": "^sri_" },
    "replay_mode": { "enum": ["offline_fixture_replay"] },
    "run_mode": { "enum": ["validation_only", "dry_run_planned"] },
    "evidence_artifacts": { "type": "array", "minItems": 1 },
    "consistency_checks": { "type": "array", "minItems": 1 },
    "status": { "enum": ["observation_evidence_bundle_ready", "observation_evidence_bundle_rejected"] },
    "reason": { "type": "string" }
  }
}
